FeedBackID,CustomerID,ProductID,Rating,Comment,FeedBackDate,Sentiment
295,400,459,5,Scientist up test machine market several raise sing sing beat modern even less.,2025-03-17,Positive
296,400,154,1,Institution generation improve those artist third cell if history executive.,2025-01-12,Negative
297,400,214,3,Home reduce defense do growth ball laugh song because society fact.,2025-01-15,Neutral
298,400,496,3,Like represent writer young.,2025-02-17,Neutral
299,400,184,4,Behind assume economy career.,2025-01-05,Positive
300,400,358,2,Bring interest guess heart second.,2025-02-11,Negative
301,400,478,2,Serve new attorney candidate house agent kid same.,2025-01-29,Negative
302,400,107,4,Teach top local Republican simply.,2025-02-09,Positive
303,400,429,3,Many sister over network partner floor.,2025-01-15,Neutral
304,400,202,1,Business conference stay return performance west deep at west project now from have.,2025-02-21,Negative
305,400,433,4,Sport present military game.,2025-02-05,Positive
306,400,13,3,Type see them happy audience here agency hotel.,2025-01-08,Neutral
307,400,298,2,Ahead speak model defense place drug simply data itself.,2025-01-03,Negative
308,400,167,4,Mother civil artist meet eye.,2025-02-17,Positive
309,400,481,3,Parent drive machine education answer.,2025-01-03,Neutral
310,400,41,2,Community south think they ago option coach consider.,2025-03-25,Negative
311,400,403,3,Firm free city agree customer.,2025-01-12,Neutral
312,400,287,1,Thank admit open back certain rise.,2025-02-01,Negative
313,400,380,5,Once must commercial all.,2025-03-01,Positive
314,400,106,1,Talk teach sense.,2025-03-29,Negative
315,400,49,5,Another soon traditional couple.,2025-02-16,Positive
316,400,33,4,Kid material along draw degree born join fire amount professor economy market approach industry.,2025-01-28,Positive
317,400,88,5,Act sometimes between sound event in focus only door.,2025-03-18,Positive
318,400,42,4,Against begin by and return human clear win.,2025-02-18,Positive
319,400,272,5,Give trip house however newspaper win trade despite individual.,2025-03-29,Positive
320,400,384,4,Instead where tax fact.,2025-02-21,Positive
321,400,200,3,Within fast under stay federal carry since company star hope may.,2025-02-12,Neutral
322,400,202,5,Sea forget rise word discover stand listen success blood director us traditional analysis claim.,2025-03-28,Positive
323,400,379,2,Look whole say.,2025-02-27,Negative
324,400,342,3,Yet rule scene catch receive use air ground among.,2025-01-17,Neutral
325,400,267,3,Teach address born size.,2025-03-18,Neutral
326,400,330,2,Set student act no against miss seat.,2025-01-03,Negative
327,400,44,3,Everything professional station machine involve her particularly mouth bank moment fight now range cultural today.,2025-03-26,Neutral
328,400,272,3,Apply force game cultural direction particularly billion along partner.,2025-03-30,Neutral
329,400,250,1,Cause although stand.,2025-03-23,Negative
330,400,394,1,Sing reduce defense popular up.,2025-01-17,Negative
331,400,433,1,Research himself improve shoulder significant else red short same later modern year firm account visit.,2025-01-28,Negative
332,400,179,1,Least fall instead fast.,2025-03-14,Negative
333,400,486,5,Expect toward determine.,2025-03-21,Positive
334,400,25,2,Can own group soldier model know management job around deal.,2025-01-17,Negative
335,400,293,1,Year institution of themselves off treat type fill.,2025-02-20,Negative
336,400,141,1,Against economic mind beyond never police expect assume.,2025-01-15,Negative
337,400,163,5,Task pressure have must rather school.,2025-03-11,Positive
338,400,67,2,Career team weight rise concern live middle could suddenly home.,2025-01-24,Negative
339,400,489,5,Save another represent over fish at along charge without become.,2025-03-22,Positive
340,400,249,2,No low society possible yard group she.,2025-03-19,Negative
341,400,337,3,Station former above sell watch result mission.,2025-03-19,Neutral
342,400,179,3,Realize behind bag surface card each attention thought light often.,2025-02-11,Neutral
343,400,261,5,Sport why unit too administration think four.,2025-01-01,Positive
344,400,387,5,Parent scene mean rather forward focus hope.,2025-02-02,Positive
345,400,498,5,Focus quality green out remain sing hot fine let.,2025-01-22,Positive
346,400,194,5,Read note girl tree trial government around.,2025-03-17,Positive
347,400,491,3,Story training after challenge sort everybody order mission natural long along issue year all two.,2025-03-25,Neutral
348,400,447,4,Standard with after look add hear student mind meet.,2025-03-21,Positive
349,400,231,3,Change film lose who eat teacher pretty direction.,2025-02-20,Neutral
350,400,161,4,Design attorney win season direction fire will watch.,2025-03-14,Positive
351,400,216,2,Perform good culture animal boy forward.,2025-02-05,Negative
352,400,59,1,Quite increase development condition significant.,2025-02-15,Negative
353,400,371,1,Everything science sense fund today hand.,2025-01-18,Negative
354,400,365,2,Course wonder Republican some friend hard.,2025-01-02,Negative
355,400,199,2,Old girl scientist moment cause human message do design town.,2025-02-08,Negative
356,400,367,4,Guy avoid capital memory wife then.,2025-02-24,Positive
357,400,352,4,Day reach toward coach second city Mr machine item.,2025-01-25,Positive
358,400,281,1,Between usually book trip task should usually raise drive chance put.,2025-01-29,Negative
359,400,376,1,Outside stop feeling think style fire institution but avoid win risk process public want inside.,2025-01-04,Negative
360,400,136,2,Manager conference energy action.,2025-02-21,Negative
361,400,430,4,Budget born cost drive local southern war different.,2025-01-28,Positive
362,400,257,2,Statement build four have ball director late service.,2025-01-02,Negative
363,400,269,4,North science seven north young situation product important take situation cover material forward.,2025-01-15,Positive
364,400,299,1,Whom attorney less TV return line unit measure factor heart.,2025-02-20,Negative
365,400,287,5,Forget once present he east agree a off stuff prove.,2025-01-12,Positive
366,400,456,1,Glass government rich step account see site who growth economic rather.,2025-03-10,Negative
367,400,272,4,People direction still fact although go sort hand least hair provide will.,2025-03-18,Positive
368,400,376,5,Ball sign important major.,2025-03-12,Positive
369,400,60,3,Respond type follow speak player soldier whatever.,2025-02-15,Neutral
370,400,299,2,Reality determine suddenly want relationship agent bring east these.,2025-01-26,Negative
371,400,317,4,Thousand vote expert reduce.,2025-01-19,Positive
372,400,40,4,Board return hit.,2025-03-26,Positive
373,400,65,5,Summer race company speak task know mean often laugh room decade provide.,2025-01-13,Positive
374,400,408,1,Military college return southern home week as another.,2025-02-28,Negative
375,400,135,3,Billion yes effect cup anyone artist.,2025-02-12,Neutral
376,400,51,2,Bad open light must so learn citizen area so me fall.,2025-03-29,Negative
377,400,350,1,Organization impact collection structure whatever politics better room.,2025-01-20,Negative
378,400,84,2,International so area yes information deep.,2025-03-30,Negative
379,400,53,4,South surface feel.,2025-02-15,Positive
380,400,398,1,Stop sister per ground during skill.,2025-01-19,Negative
381,400,237,5,Congress necessary only design same large treat.,2025-02-03,Positive
382,400,257,2,Foreign trial policy probably with lead happy buy education work expert.,2025-01-03,Negative
383,400,316,5,Different trouble nice brother rate scientist road.,2025-01-30,Positive
384,400,273,5,Tough close use near.,2025-03-23,Positive
385,400,468,4,Friend mouth support instead pressure sit approach.,2025-01-07,Positive
386,400,423,2,Special sea hope war trial remain argue democratic serve.,2025-02-11,Negative
387,400,286,5,Trade during back couple for during.,2025-02-23,Positive
388,400,331,2,Head me rest water above agent particular energy drop suggest cost compare then effort.,2025-01-23,Negative
389,400,7,2,Area face when house dinner particularly memory.,2025-01-23,Negative
390,400,100,2,Gas discover law good well church.,2025-02-15,Negative
391,400,260,4,Rich arrive final once close section decision age.,2025-01-06,Positive
392,400,435,4,Meet because knowledge Democrat allow choice.,2025-01-09,Positive
393,400,371,3,More assume subject eye old identify month station necessary study lawyer.,2025-01-20,Neutral
394,400,123,4,Hour forward note understand approach.,2025-02-21,Positive
395,400,262,1,Writer sense heavy people into.,2025-01-05,Negative
396,400,369,2,Your far call guy man pick war mouth growth myself improve decision never.,2025-03-15,Negative
397,400,111,5,Save young scientist according reflect.,2025-02-19,Positive
398,400,467,3,Much take response able give food could throw dream relationship name owner land.,2025-03-17,Neutral
399,400,294,2,Second type stay baby certainly again hot.,2025-03-08,Negative
400,400,324,4,Control can picture author although writer well choice often interview expect describe.,2025-01-08,Positive
